{"decode":{"id":"program/29dca85be1e4082f730afb5a8608f3af0f524748741a66c142318c513350f01e","op":"seq","result":{"ref":"b_6b24591f8d768d31b1d5b658a1fb2a24dda43581208c3677e1c6716ce50fba6f"},"steps":[{"bind":"b_7dfa2eb305ae22adb0e0ff8e561db938e52f9b9b95103a8704be151b99da9c46","node":{"codec":"uint8","id":"program/29dca85be1e4082f730afb5a8608f3af0f524748741a66c142318c513350f01e/a","op":"atom"}},{"bind":"b_cbe1aca3a7a9afa242f87f6b2566620297a00f3b8462befac91b59fedd98db9a","node":{"codec":"uint8","id":"program/29dca85be1e4082f730afb5a8608f3af0f524748741a66c142318c513350f01e/b","op":"atom"}},{"bind":"b_4d5105db6258c2a09cb0d798d1cc7fd97a5c78fb7b808992421f911a2668ecc2","node":{"codec":"uint8","id":"program/29dca85be1e4082f730afb5a8608f3af0f524748741a66c142318c513350f01e/c","op":"atom"}},{"bind":"b_6b24591f8d768d31b1d5b658a1fb2a24dda43581208c3677e1c6716ce50fba6f","node":{"id":"program/29dca85be1e4082f730afb5a8608f3af0f524748741a66c142318c513350f01e/total/d0b43c8497cd55d931ea39feac38d3d094c8d99e532226857dd5dfebcb494926","op":"seq","result":{"ref":"b_12921ac48a65d073c087e2af9528f46ee9b9b29fa2823aa90566efddc3fb77c5"},"steps":[{"bind":"b_349203bc186dad4318607d9477f3a39fac2fb1802b734716f15824ccd0e75a97","node":{"id":"program/29dca85be1e4082f730afb5a8608f3af0f524748741a66c142318c513350f01e/total/d0b43c8497cd55d931ea39feac38d3d094c8d99e532226857dd5dfebcb494926/first/d62e6430dcceea261f2d97eb4ac186a92454bcf2eb50df7ab32f8ec103cf28cb","op":"seq","result":{"ref":"b_d21f62938355f5463ca780398e5c6c658a2248b3597f2de740a54298f6b1ea87"},"steps":[{"bind":"b_d21f62938355f5463ca780398e5c6c658a2248b3597f2de740a54298f6b1ea87","node":{"expr":{"add":[{"ref":"b_7dfa2eb305ae22adb0e0ff8e561db938e52f9b9b95103a8704be151b99da9c46"},{"ref":"b_cbe1aca3a7a9afa242f87f6b2566620297a00f3b8462befac91b59fedd98db9a"}]},"id":"program/29dca85be1e4082f730afb5a8608f3af0f524748741a66c142318c513350f01e/total/d0b43c8497cd55d931ea39feac38d3d094c8d99e532226857dd5dfebcb494926/first/d62e6430dcceea261f2d97eb4ac186a92454bcf2eb50df7ab32f8ec103cf28cb/sum","op":"value"}}]}},{"bind":"b_12921ac48a65d073c087e2af9528f46ee9b9b29fa2823aa90566efddc3fb77c5","node":{"id":"program/29dca85be1e4082f730afb5a8608f3af0f524748741a66c142318c513350f01e/total/d0b43c8497cd55d931ea39feac38d3d094c8d99e532226857dd5dfebcb494926/second/d62e6430dcceea261f2d97eb4ac186a92454bcf2eb50df7ab32f8ec103cf28cb","op":"seq","result":{"ref":"b_bb279aebddafd0c4fc7455b10a9ea8982b8b793a87028fe73b697734f9a06ec9"},"steps":[{"bind":"b_bb279aebddafd0c4fc7455b10a9ea8982b8b793a87028fe73b697734f9a06ec9","node":{"expr":{"add":[{"ref":"b_349203bc186dad4318607d9477f3a39fac2fb1802b734716f15824ccd0e75a97"},{"ref":"b_4d5105db6258c2a09cb0d798d1cc7fd97a5c78fb7b808992421f911a2668ecc2"}]},"id":"program/29dca85be1e4082f730afb5a8608f3af0f524748741a66c142318c513350f01e/total/d0b43c8497cd55d931ea39feac38d3d094c8d99e532226857dd5dfebcb494926/second/d62e6430dcceea261f2d97eb4ac186a92454bcf2eb50df7ab32f8ec103cf28cb/sum","op":"value"}}]}}]}},{"bind":"b_daaee9e31642f125dc2da27fe847940a752daa053de2ada6650815828972df6f","node":{"code":"TOTAL","id":"program/29dca85be1e4082f730afb5a8608f3af0f524748741a66c142318c513350f01e/capacity","op":"check","site":{"ref":"b_7dfa2eb305ae22adb0e0ff8e561db938e52f9b9b95103a8704be151b99da9c46"},"test":{"le":[{"ref":"b_6b24591f8d768d31b1d5b658a1fb2a24dda43581208c3677e1c6716ce50fba6f"},{"const":300}]}}},{"bind":"b_6b57917aae08db0147f2e4e7b4ddce0f95f0b3b3e1a34da3d33aad883fe28b13","node":{"id":"program/29dca85be1e4082f730afb5a8608f3af0f524748741a66c142318c513350f01e/complete","op":"end"}}]},"encode":{"codec":"uint16be","expr":{"ref":"root"},"id":"program/29dca85be1e4082f730afb5a8608f3af0f524748741a66c142318c513350f01e/encode","op":"emit"},"rules":{},"text":false,"version":"semantic-plan-1"}
