{"decode":{"id":"program/d966a87aea0c0367c0fdbb4a25e693e29ee7558a9a9250784408ca887ab6c642","op":"seq","result":{"ref":"b_8117530cdcb6028d33e54be2998cf5547de00cb57d842d6ace51f6cb0f08031d"},"steps":[{"bind":"b_8f646d8fa18347ebe333237bc712f63d0514440288bb49b823347f08e1ae0b69","node":{"codec":"uint8","id":"program/d966a87aea0c0367c0fdbb4a25e693e29ee7558a9a9250784408ca887ab6c642/a","op":"atom"}},{"bind":"b_a8e4d5fdf1c5200944ebdc60e8ce8a149043aae7885cf8cee23c978aed83937a","node":{"codec":"uint8","id":"program/d966a87aea0c0367c0fdbb4a25e693e29ee7558a9a9250784408ca887ab6c642/b","op":"atom"}},{"bind":"b_7fdb5f45c404fed94d2bfa6c1098a349caa5154de771e078dd9b044b8382bbda","node":{"expr":{"add":[{"ref":"b_8f646d8fa18347ebe333237bc712f63d0514440288bb49b823347f08e1ae0b69"},{"ref":"b_8f646d8fa18347ebe333237bc712f63d0514440288bb49b823347f08e1ae0b69"}]},"id":"program/d966a87aea0c0367c0fdbb4a25e693e29ee7558a9a9250784408ca887ab6c642/twice","op":"value"}},{"bind":"b_8117530cdcb6028d33e54be2998cf5547de00cb57d842d6ace51f6cb0f08031d","node":{"expr":{"add":[{"ref":"b_7fdb5f45c404fed94d2bfa6c1098a349caa5154de771e078dd9b044b8382bbda"},{"ref":"b_a8e4d5fdf1c5200944ebdc60e8ce8a149043aae7885cf8cee23c978aed83937a"}]},"id":"program/d966a87aea0c0367c0fdbb4a25e693e29ee7558a9a9250784408ca887ab6c642/total","op":"value"}},{"bind":"b_cb69b1e60596326fe0364a4ebaba2543dc6c6fd8144cfa95af5d46ae09b823f2","node":{"code":"QUOTE","id":"program/d966a87aea0c0367c0fdbb4a25e693e29ee7558a9a9250784408ca887ab6c642/capacity","op":"check","site":{"ref":"b_8f646d8fa18347ebe333237bc712f63d0514440288bb49b823347f08e1ae0b69"},"test":{"le":[{"ref":"b_8117530cdcb6028d33e54be2998cf5547de00cb57d842d6ace51f6cb0f08031d"},{"const":600}]}}},{"bind":"b_edf1ca1e7769707c30af91e105a1b7adfe4415fda36cf06fbdb76f96e785d027","node":{"id":"program/d966a87aea0c0367c0fdbb4a25e693e29ee7558a9a9250784408ca887ab6c642/complete","op":"end"}}]},"encode":{"codec":"uint16be","expr":{"ref":"root"},"id":"program/d966a87aea0c0367c0fdbb4a25e693e29ee7558a9a9250784408ca887ab6c642/encode","op":"emit"},"rules":{},"text":false,"version":"semantic-plan-1"}
